{
  "contract_format_version": 2,
  "kind": "repo_code_contract",
  "name": "ceratops_code_repo_deterministic_contract",
  "captured_on": "2026-05-02",
  "source_files": [
    {
      "path": "$AI_AGENT_SKILLS_ROOT/skills/ceratops-repo-lifecycle/references/contracts/github-contract-source-docs.json",
      "lines": "source-doc registry"
    },
    {
      "path": "$AI_AGENT_SKILLS_ROOT/skills/ceratops-repo-lifecycle/references/health-audit.md",
      "lines": "contract owner"
    },
    {
      "path": "$AI_AGENT_SKILLS_ROOT/skills/ceratops-repo-lifecycle/scripts/ceratops_repo_compatibility_engine/sdlc_contract_validation.py",
      "lines": "shared SDLC schema validation"
    },
    {
      "path": "$AI_AGENT_SKILLS_ROOT/skills/ceratops-repo-lifecycle/scripts/ceratops_repo_compatibility_engine/validate_ceratops_compatibility.py",
      "lines": "shared repository compatibility checker"
    }
  ],
  "parameters": {
    "owner": {
      "type": "string",
      "required": true
    },
    "repo": {
      "type": "string",
      "required": true
    },
    "default_branch": {
      "type": "string",
      "required": false,
      "default_from": "repo.default_branch"
    },
    "local_repo_path": {
      "type": "string",
      "required": false
    },
    "repository_validation_evidence_file": {
      "type": "string",
      "required": false
    },
    "expected_maintainer_bypass_actors": {
      "type": "array",
      "required": false,
      "default": []
    }
  },
  "required_scopes": [
    "repo"
  ],
  "optional_scopes_for_full_screen_parity": [],
  "source_docs_ref": "github-contract-source-docs.json",
  "source_doc_scopes": [
    "repo"
  ],
  "approved_drift": {
    "exclusions": [],
    "allowances": [
      {
        "id": "archived_repos_report_only",
        "when": "repo.archived == true",
        "check_ids": [
          "*"
        ],
        "reason": "Archived repositories are immutable health inventory, not repair targets."
      }
    ]
  },
  "remediation_policy": {
    "default": "report_only",
    "apply_flag": null,
    "destructive_or_irreversible": "always_report_only"
  },
  "fetch_bundles": [
    {
      "id": "repo_content_bundle",
      "requests": [
        {
          "method": "GET",
          "endpoint": "/repos/${owner}/${repo}/git/trees/${default_branch}?recursive=1",
          "covers_checks": [
            "type.path_signals",
            "content.required_files_presence",
            "security.dependabot_config_file",
            "stale_state.local_path_references"
          ]
        },
        {
          "method": "GET",
          "endpoint": "/repos/${owner}/${repo}/languages",
          "covers_checks": [
            "type.language_signals"
          ]
        },
        {
          "method": "GET",
          "endpoint": "/repos/${owner}/${repo}/codeowners/errors",
          "covers_checks": [
            "content.codeowners_valid"
          ]
        }
      ]
    },
    {
      "id": "local_repo_scan_bundle",
      "sources": [
        "${local_repo_path}"
      ],
      "covers_checks": [
        "type.path_signals",
        "actions.workflow_sha_pinning",
        "security.dependabot_config_file",
        "content.required_files_presence",
        "content.sdlc_contract_schema",
        "content.ceratops_compatibility",
        "content.repository_validation",
        "local.git_state",
        "content.local_secret_pattern_scan",
        "stale_state.local_path_references"
      ],
      "applies_when": "local_repo_path is provided"
    }
  ],
  "checks": [
    {
      "id": "type.path_signals",
      "kind": "classification",
      "applies_when": "always",
      "assertions": [
        {
          "path": "/repository/types",
          "operator": "truthy"
        }
      ]
    },
    {
      "id": "type.language_signals",
      "kind": "classification",
      "applies_when": "always",
      "assertions": [
        {
          "path": "/repository/types/language_or_iac",
          "operator": "not_empty"
        }
      ]
    },
    {
      "id": "actions.workflow_sha_pinning",
      "kind": "tree_scan",
      "applies_when": "type.workflow_surface has has_workflows",
      "assertions": [
        {
          "path": "/local/available",
          "operator": "equal",
          "expected": true
        },
        {
          "path": "/local/workflows/unpinned_external_refs",
          "operator": "empty"
        }
      ]
    },
    {
      "id": "security.dependabot_config_file",
      "kind": "tree_scan",
      "applies_when": "repo.archived == false && repo.fork == false && package_manifests_present == true",
      "assertions": [
        {
          "path": "/repository/content/dependabot/config_present",
          "operator": "equal",
          "expected": true
        },
        {
          "path": "/repository/content/dependabot/text_available",
          "operator": "equal",
          "expected": true
        },
        {
          "path": "/repository/content/dependabot/missing_ecosystems",
          "operator": "empty",
          "level": "WARN"
        },
        {
          "path": "/repository/content/dependabot/missing_manifest_directories",
          "operator": "empty",
          "level": "WARN"
        },
        {
          "path": "/repository/content/dependabot/unmatched_configured_directories",
          "operator": "empty",
          "level": "WARN"
        },
        {
          "path": "/repository/content/dependabot/config_errors",
          "operator": "empty"
        },
        {
          "path": "/repository/content/dependabot/updates_present",
          "operator": "equal",
          "expected": true
        },
        {
          "path": "/repository/content/dependabot/schedule_present",
          "operator": "equal",
          "expected": true
        }
      ]
    },
    {
      "id": "content.required_files_presence",
      "kind": "api_and_tree",
      "applies_when": "repo.archived == false",
      "assertions": [
        {
          "path": "/repository/paths",
          "operator": "glob_present",
          "expected": "README.md"
        },
        {
          "path": "/repository/paths",
          "operator": "glob_present",
          "expected": "LICENSE",
          "when": "repo.visibility == public && repo.fork == false"
        },
        {
          "path": "/repository/paths",
          "operator": "glob_present",
          "expected": "SECURITY.md",
          "when": "repo.visibility == public && repo.fork == false"
        },
        {
          "path": "/repository/paths",
          "operator": "glob_present",
          "expected": "CONTRIBUTING.md",
          "when": "repo.visibility == public && repo.fork == false"
        },
        {
          "path": "/repository/paths",
          "operator": "glob_present",
          "expected": "CODE_OF_CONDUCT.md",
          "when": "repo.visibility == public && repo.fork == false"
        },
        {
          "path": "/repository/paths",
          "operator": "glob_present",
          "expected": ".github/CODEOWNERS",
          "when": "repo.visibility == public && repo.fork == false"
        }
      ]
    },
    {
      "id": "content.codeowners_valid",
      "kind": "api",
      "endpoint": "/repos/${owner}/${repo}/codeowners/errors",
      "applies_when": "repository.codeowners_present",
      "assertions": [
        {
          "path": "/repository/content/codeowners_errors_available",
          "operator": "equal",
          "expected": true,
          "level": "WARN"
        },
        {
          "path": "/repository/content/codeowners_errors",
          "operator": "empty"
        }
      ]
    },
    {
      "id": "content.sdlc_contract_schema",
      "kind": "local_contract",
      "applies_when": "local_repo_path is provided && local.sdlc_contract.present == true",
      "assertions": [
        {
          "path": "/local/sdlc_contract/errors",
          "operator": "empty"
        }
      ]
    },
    {
      "id": "content.ceratops_compatibility",
      "kind": "local_contract",
      "applies_when": "local_repo_path is provided && local.compatibility.applicable == true",
      "assertions": [
        {
          "path": "/local/compatibility/errors",
          "operator": "empty"
        }
      ]
    },
    {
      "id": "content.repository_validation",
      "kind": "local_contract",
      "applies_when": "local_repo_path is provided",
      "assertions": [
        {
          "path": "/local/repository_validation/validator_present",
          "operator": "equal",
          "expected": true
        },
        {
          "path": "/local/repository_validation/workflow_present",
          "operator": "equal",
          "expected": true
        },
        {
          "path": "/local/repository_validation/valid",
          "operator": "equal",
          "expected": true
        },
        {
          "path": "/local/repository_validation/errors",
          "operator": "empty"
        }
      ]
    },
    {
      "id": "local.git_state",
      "kind": "local_git",
      "applies_when": "local_repo_path is provided",
      "assertions": [
        {
          "path": "/local/git/available",
          "operator": "equal",
          "expected": true,
          "level": "WARN"
        },
        {
          "path": "/local/git/worktree_clean",
          "operator": "equal",
          "expected": true,
          "level": "WARN"
        },
        {
          "path": "/local/git/current_branch",
          "operator": "equal",
          "expected": "${default_branch}",
          "level": "WARN"
        },
        {
          "path": "/local/git/tracks_remote_default_branch",
          "operator": "equal",
          "expected": true,
          "level": "WARN"
        }
      ]
    },
    {
      "id": "stale_state.local_path_references",
      "kind": "tree_scan",
      "applies_when": "local_repo_path is provided && repo.archived == false",
      "assertions": [